Id,Title,Location,Salary,Summary
ef847388cd119b0b,Cross Border Ecommerce (Korea) - Team As...,Shopee 서울,,various department on process improvement Able to adapt and react quickly to changing needs and business decisions Other ad...
c29823ee42322d62,"react, Typescript 신입/경력 정규직",펠로워즈 서울 마포구,"연봉 35,000,000원 - 40,000,000원","합니다 - 다양한 브라우저 환경에서 사용자에게 최고의 경험을 줄수 있도록 개발합니다 [필요한 기술은?] - React, Redux - TypeScript - ES6+, WebPack, Babel 등의 기술에 대한 이해와 경험..."
bd87d7e802ec26cc,[NAVER Cloud] WORKBOX(파일공유) 서버 개발 경력사원,네이버 서울,,"등의 데이터 저장소 관련 역량 [ 우대사항] - 비동기 프로그래밍 등 고성능 어플리케이션 개발 경험 - React, Vue.js 등 최신 Framework 중 하나 이상 개발 경험 전형절차 및 기타사항 1. 전형절차..."
09a7b504ae035725,"프론트엔드, 백엔드 신입/경력 정규직",로켓메이커스 서울 마포구,"연봉 30,000,000원 - 35,000,000원","발자 Django/ React 개발자 모집 공고: https://bit.ly/34qIBcj 채용 포지션 - Django / React 신입 또는 주니어... 경험 - 프론트 : Next, React 사용 경험 우대사항 - 협업 프로..."
585c5742d4ec1a3a,[크랙원] 프론트엔드 React-natvie 개발자,크랙원(Crack1) 서울 동대문구,"월급 2,000,000원","React-native를 이용한 앱/웹 프론트 개선 - React를 이용한... 학력사항: 대학(2,3년)졸업 이상 직무기술: react, react-native, flutter React 개발자 0 명 근무조건 고용형태..."
a8e2cf694a66f761,[중소기업유통센터] `21년 상반기 경력직,중소기업유통센터 서울,,"대사항) 석사 이상, 연구직 수행 경력자 3. 전산 개발자 : (우대사항) JAVA 프레임워크 기반 웹 및 React, Vue, angular 등 쇼핑몰 프론트 개발가능자 / 전자정부프레임워크 기반개발 가능자 (Java) 및..."
3d8b47f388277875,ITO/IDC 시스템 운영 경력사원 채용,한화그룹 4.2 서울,,"기반 개발 경험자(javascript, jquery 등) [우대요건] Front-End(Angular, React 등) 라이브러리 개발 또는 운영 경험 Back-End(RESTful API 기반) 개발에 대한 이해 데이터베..."
4a0ddfbfc4a11dd0,프론트엔드 파운트 개발자 (현재 급여 이상 보장),파운트 서울 충정로역,,에 대해 이해하시는 분 - React 등 javascript... 경험이 있으신 분 우대사항 - 모바일 앱 개발 경험이 있으신 분 React-Native 경험이 있으신 분 - Webpack / Babel 등...
59c9ee6a635c251a,React Native Developer,아우름플래닛 서울 마포구,,자격요건] • React Native 개발에 능숙한 분 • REST API를 이용한 클라이언트 개발 경험이 있는 분 • React Native 개발... 개발해 본 경험이 있는 분 • React로 웹 Front-end를 실무...
f1c326e9041a027c,"[내일애-2차 청년스타트업] (주)콘스탄트 개발, 디자인 직원",콘스탄트 서울 마포구,,"[개발] - 경력 3년 이상 - React, Spring Framework 개발 경험 [디자인] - 경력 및 유사경험 3년 이상 - XD, Photoshop, Zeplin, Illustrator 인터넷·IT·통신·모바일·게임..."
3cf01580ba5eb23a,NLP Researcher,AITRICS 서울,,"HTML, Javascript(Typescript), CSS(Sass) Library/Framework : React(Next.js), Vue(Nuxt.js), Rx.js, D3(Observablehq), Jest..."
7818c92e8480d5d7,한화생명 Front-End / Back-End 개발자 경력채용,한화그룹 4.2 서울,,"혹은 그에 준하는 실력 • HTML5, CSS3, Javascript에 대한 깊은 이해 • ES6+, React 기술 경험 • Webpack 등의 빌드 도구 경험 • 웹 프론트 기술 흐름에 지속적으로 관심갖는 분 • 논리적..."
bde56f46af4e9a3a,[신입/경력] 모바일/웹 개발자 정규직,블랍스 서울 강남구,"연봉 40,000,000원 - 50,000,000원","웹 개발자 경력직 ( react / react-native) 모집부문 및 자격요건 담당업무 자격요건 인원 [담당업무] - 담당 업무 : 모바일/웹 솔루션 개발 - 사용기술 : react-native, react [근무부서 및..."
9ba2af0dadae83c3,프론트엔드 웹 개발자,펄핏 서울 강남구,,"자격요건(필수), 어떤 조건이 필요한가요? 기본적인 자료구조, 알고리즘 및 컴퓨터 사이언스에 대한 이해 React, Angular 등의 frontend framework 사용 경험 (+자유자재로 다룬다) Webpack 등의..."
5e4a560d596df0b6,Office Admin,Success Korea 서울 서소문동,,regarding all reception and office facility matters and react appropriately to queries raised; Support Area manager with ad...
79d01e0b0ee26baa,"웹/앱 개발 및 신기술(솔루션) 개발, 데이터 분석 플랫폼 개발, 시스템...",코어포인트 서울 영등포구,,"비스 운영 경험이나 관심 2) SPA 프론트엔드 개발 경험이나 관심 ( React, View.js, Vanilla 등) 3) 모바일 개발 경험이나 관심... AanguarJS, Node.JS, React 3) MSSQL 4) 해당분..."
ef33074c2e45e2b6,"웹 프론트엔드 개발자 (산업기능요원, 전문연구요원)",우아한 형제들 서울 송파구,,"SASS), Javascript(ES2015+) - 주요 라이브러리: Webpack, Babel, ESLint, React, Vue, Redux, Redux-Saga - 업무도구: Git, Github, AWS, Jira..."
f646e85ff3e17ed8,Data Scientist - IBM Garage,IBM 3.9 서울,,"Work in an Agile fashion, iterating... design to react to client feedback and demonstrate rapid progress * Expand..."
2dbe4c7e2066d839,"css, 웹퍼블리셔(HTML코딩) 외 경력 정규직",에이피서비스 서울 강남구,"연봉 50,000,000원 - 60,000,000원","자격요건 담당업무 자격요건 인원 [담당업무] 웹퍼블리싱 및 UI개발(Html5,CSS,Javascript) - React,Vue 환경에서의 마크업에 대한 이해를 기반 - UI 구현 - 소스 버전관리 (SVN,GIT등) 경험을..."
a1e3992a62a45541,SmilePay & SmileCash Frontend 개발,이베이 코리아 서울 강남구,,"등에 대한 이해화 경험이 있으신 분 - React, Node js, Javascript, C#, Jquery 등으로 Frontend 개발 경험이 있으신 분 [우대사항] - React, Redux 경험자 [공통요건..."
7611894be6d2b8b2,[Anti-Cheat] 플랫폼 엔지니어,PUBG 서울,,"스템 개발 [지원 자격] - NodeJS 또는 Go (TypeScript, Golang) 개발 능력 - React, Vue, Angular 등을 사용한 SPA 웹 서비스 개발 경험 - AWS 등 클라우드 서비스 사용 경험..."
3bafdba72ed14ee9,"다음 첫화면,뉴스,스포츠,연예,1boon 유저웹서비스 개발자 모집",카카오 4.0 성남 판교역,,"사용 경험 Kotlin 개발 경험 실시간 데이터 처리 경험 React 프레임워크 환경 경험자 코드 리팩토링을 즐기시는 분 프론트엔드의 경우 ES6, React, Webpack 으로 Single-page Application..."
7818c92e8480d5d7,한화생명 Front-End / Back-End 개발자 경력채용,한화그룹 4.2 서울,,"혹은 그에 준하는 실력 • HTML5, CSS3, Javascript에 대한 깊은 이해 • ES6+, React 기술 경험 • Webpack 등의 빌드 도구 경험 • 웹 프론트 기술 흐름에 지속적으로 관심갖는 분 • 논리적..."
734e41fc4ecd6411,[국내 최고회사] Front-End 개발자,인코리아 프로페셔널 성남 분당구,,"분- Javascript Framework를 사용하여 SPA 개발 경험이 있으신 분 ② 우대 조건 :- React, Vue 등 최신 인터넷·IT·통신·모바일·게임>웹프로그래머>HTML·DHTML·mHTML|인터넷·IT·통신..."
0ce778bde9f5875c,[ANTI-CHEAT] 플랫폼 엔지니어,펍지 서울 서초구,,"및 운영 - 안티치트 운영 자동화 시스템 개발 [지원 자격] - NodeJS 또는 C# 개발 능력 - React, Vue, Angular 등을 사용한 SPA 웹 서비스 개발 경험 - JavaScript/TypeScript..."
3d8b47f388277875,ITO/IDC 시스템 운영 경력사원 채용,한화그룹 4.2 서울,,"기반 개발 경험자(javascript, jquery 등) [우대요건] Front-End(Angular, React 등) 라이브러리 개발 또는 운영 경험 Back-End(RESTful API 기반) 개발에 대한 이해 데이터베..."
56d9b359cfbbf1de,Software Engineer (Embedded/ Numerical C...,BOEING 서울,,"C#, Enterprise Kubernetes Container Service (KCS), Node.js, React.js, Three.js, Google OR-Tools, C++ Google Test/Google Mock..."
497133c0f23d645a,웹 및 프론트앤드 개발자,아이오티포헬스 서울 영등포구,"연봉 30,000,000원 - 50,000,000원","직무내용] [담당업무]- 글로벌 헬스케어(원격의료) 솔루션 개발[세부업무]- JavaScript, React... Front-end 개발- Web Publishing[우대조건]- 헬스케어(원격의료) 개발 경험자- 병원..."
b8dead3d3c72d10c,"프론트엔드 , 웹퍼블리셔",리스트 서울 영등포구,"월급 2,000,000원","합니다. 프론트엔드 , 웹퍼블리셔 개발 분야 ㆍCSS, jQuery, HTML 필수 ㆍ웹퍼블리싱 필수 ㆍ React 가능자 우대 ㆍ모바일 웹/앱 경험자 우대 [근무시간 및 형태] 주 5일 근무 (오전) 10시 00분~(오후..."
1da981356c4889fc,프론트엔드 개발자 - GAME DEV본부,펍지 서울 서초구,,텍처 설계 - 제한된 리소스 내에서 문제없이 돌아가는 웹 서비스를 만들기 위해 퍼포먼스 최적화 [지원 자격] - React/Angular/Vue 등을 이용해 Single Page Application을 구축한 경험이 있는 분...
a1e3992a62a45541,SmilePay & SmileCash Frontend 개발,이베이 코리아 서울 강남구,,"등에 대한 이해화 경험이 있으신 분 - React, Node js, Javascript, C#, Jquery 등으로 Frontend 개발 경험이 있으신 분 [우대사항] - React, Redux 경험자 [공통요건..."
91aa3bd221ee815b,AI Service Planning/Business Development,AITRICS 서울,,"HTML, Javascript(Typescript), CSS(Sass) Library/Framework : React(Next.js), Vue(Nuxt.js), Rx.js, D3(Observablehq), Jest..."
d4e33cbc1b805c6e,(주) 랭킹피쉬 프론트엔드 개발자,랭킹피쉬 서울 성동구,"연봉 24,000,000원 - 40,000,000원","가능)ㆍHTML5, CSS, javascript 등 프론트엔드 웹 개발에 관련된 기본 지식을 보유하신 분ㆍ React 프레임워크를 활용한 개발 경험이 있는 분ㆍ다양한 포지션의 팀원들 사이 커뮤니케이션이 원활한 분우대사항ㆍ플랫폼..."
46a3584564c48ab6,Software Engineer (Front-end),Streami 서울,"연봉 35,000,000원 - 80,000,000원","JavaScript * Experience with JavaScript UI Framework ( React, Vue, Angular) * Understanding DOM Structure * Excellence..."
3fc69646e3aa3740,(주)스포카 개발자 채용,스포카 서울 역삼동,,"신속한 제품 개선과 JSX를 통한 생산성, 효율적인 유지 보수를 위해 React를 사용합니다. 또, 타입 불일치나 null 미확인 등으로 인한 사소하... 효율적으로 재사용할 수 있도록 React 컴포넌트 라이브러리로 만드는 과제..."
8a48c202f69d2877,Front-end 웹/앱 개발자 (병역특례 가능),스마트디아그노시스 서울 마포구,,"Window App 개발 경험 보유 [담당업무] - Android, React(web) 기반의 UI위주의 구현 - Python(PySide2) 기반의... AWS EC2를 이용한 React App 배포 경험 - Android 및..."
b4034af977e9e15e,유명 주식투자 컨설팅 기업 안드로이드 앱개발 정규직,인파트너스 서울 서초구,"연봉 50,000,000원 - 60,000,000원","iOS 개발 가능자 (우대) - 팀내, 팀간 소통에 문제 없고 책임감이 있으신 분 우대사항 : - React Native 또는 Flutter 가능자 - 웹언어 1개이상 이해 또는 경험이 있으신 분 연봉 ~ MAX 5..."
02493f1b0f7d3149,[정규직] 반도체 후공정(Package & Test) IT시스템 구축 및...,SK 씨앤씨 4.0 서울,,"Tib/RV 등) 활용기술 . DB 활용기술(ORACLE, MS-SQL, DB4 등) . UX 개발자 : React, Java Script, Java, Any Frame, HTML5, CSS, Jquery . 반복/점진..."
e839e2e757e5c03a,Development (Front-End),Nearthlab 서울,,front-end development using latest frameworks... React and Vue – Experiences in system automation... testing...
d90d480960387a85,Front-end Software Engineer,Bear Robotics 서울,,로봇의 터치스크린 UI 애플리케이션을 사용하기 편리하게 만듭니다. 자격 요건 React 또는 React-Native를 사용한 개발 / 릴리즈 경험 React 및 모던 프론트엔드 개발 흐름과 ECMAScript에 대한 이해...
164143859b071719,프론트엔드 엔지니어,RIDI Corp 서울,,"개발 React 기반 웹, 모바일, 데스크탑 등 멀티 플랫폼 클라이언트 개발 자격 요건 프론트엔드 개발 경력 3년 이상 React 개발 흐름과 JavaScript에 대한 깊은 이해 React기반 서비스 개발 및 릴리즈..."
02439c0627b4b18f,[경력] 백엔드 개발자 - 패스트캠퍼스FCL,패스트캠퍼스 서울,,"그때의 환경에 유동적으로 대응해 나갈 예정으로 아래의 내용은 추후 변경될 수 있습니다. • React / Redux • React Native • NodeJS / Express, Koa • NextJS • MySQL..."
29e80c7685907ed5,"프론트엔드, 백엔드, Java·JSP 신입,경력사원",틴텍씨앤씨 서울 강서구,,"담당업무] 웹 개발, Vuejs, React, 자바 Spring Boot... javascript, jquery를 이용한 개발 가능 ※우대사항 - React/Vue.js 중 1개 이상 사용 경험자 -웹표준, 웹접근성, 크로스 브라..."
9801eb995941c2da,[프리랜서] 자바스크립트 개발자,북틀 서울 마포구,"월급 5,000,000원","3년 이상 - Javascript, JQuery 가능자 - Vue, React 등 자바스크립트 프레임웍 경험자 우대조건 - 유관업무 경험자 - 웹 개발... 프로그래밍, 웹개발기타: Vue, React 등 자바스크립트 프레임웍 경험자..."
2dbe4c7e2066d839,"css, 웹퍼블리셔(HTML코딩) 외 경력 정규직",에이피서비스 서울 강남구,"연봉 50,000,000원 - 60,000,000원","자격요건 담당업무 자격요건 인원 [담당업무] 웹퍼블리싱 및 UI개발(Html5,CSS,Javascript) - React,Vue 환경에서의 마크업에 대한 이해를 기반 - UI 구현 - 소스 버전관리 (SVN,GIT등) 경험을..."
771dd4e1a74cde31,[공통기술부문] 공통 플랫폼 개발자,우아한 형제들 서울 송파구,,"보신 분 - RDB 및 Elasticsearch, Redis 등 다양한 NoSQL 기술 경험이 있으신 분 - React를 이용한 Front-end 개발 경험이 있으신 분 - 우아한형제들의 다양한 서비스에서 활용할 새로운 가치..."
5bfcdbb81dd0d7be,[검색] 프론트엔드 엔지니어 (전문연구요원 가능),버즈니 서울,,"습니다 관련 업무 최소 5년 이상 혹은 그에 준하는 이력이 있으신 분 (전문연구요원의 경우 경력 무관) React 기반의 프로젝트 경험이 있으신 분 데이터 시각화 경험이 있으신 분 Javascript 및 HTML5, CSS3..."
d4e33cbc1b805c6e,(주) 랭킹피쉬 프론트엔드 개발자,랭킹피쉬 서울 성동구,"연봉 24,000,000원 - 40,000,000원","가능)ㆍHTML5, CSS, javascript 등 프론트엔드 웹 개발에 관련된 기본 지식을 보유하신 분ㆍ React 프레임워크를 활용한 개발 경험이 있는 분ㆍ다양한 포지션의 팀원들 사이 커뮤니케이션이 원활한 분우대사항ㆍ플랫폼..."
d4fedbedf819ba56,AI 인공지능 서비스 플랫폼 개발자,코그넷나인 서울 서초구,,"사용 경험자 음성인식 / 자연어 처리를 위한 Deep Learning 알고리즘에 대한 경험자 Vue, React 기반 웹서비스 개발 경험자 ▷전형단계 및 제출서류 전형단계: 서류전형 > 면접진행 > 최종심사 > 최종합..."
fdd1ec500461c093,"프론트엔드, 백엔드 개발 경력 정규직",토이스미스 서울 강남구,,"레임워크 사용 능력 (jQuery, React, Vue, Angular 등... JAVA, TypeScript, Python 등) l Node & React 스택의 개발자 l Spring Framework 및 오픈소스 활용 경험..."
109be79a3d9a412a,웹 디자이너 / 서비스 엔지니어 ( PHP 및 웹서비스 개발자 ),에스비씨엔 서울 영등포구,,"경험 : PHP, JavaScript(ES5+), 모던 HTML 및 CSS. 우대사항 - 1년 이상의 React 경험자. - 웹서비스 런칭 및 유지보수 경험자 - 결제사 연동 및 SMS 서비스 연동 경험자 근무조..."
3b9719a191ef0273,UI마크업 개발자(),NHN SOFT 4.4 성남 판교역,,자 - 적극적이고 책임감 있는 자 - 다양한 디바이스 크로스 브라우징 기술력을 보유한 자 - vuejs/ react/bootstrap 등 최신 FE 환경에 대한 마크업 경험자 - javascript 활용 가능자 본...
2e4e6069ed2abe32,[2021?????] Web Frontend Software Engine...,Hyperconnect 서울,,"UI . flexibility .nbsp; TypeScript static typing , vue.js react.js . , jquery / javaScript . HakunaHakuna .2... nbsp..."
bb47929cc81c7bd7,[내일애-1차 스마트공장] (주)스페이스솔루션 웹개발자,스페이스솔루션 서울 금천구,,"표준 및 접근성(크로스 브라우징) 관련 이슈 대응 가능자 우대사항 • 웹 프론트엔드 개발 경력 1년 이상 • React, vue.js 개발 경험 • RESTful API 클라이언트 개발 경험이 있으신 분 • UI/UX 가이드..."
ac84c38e5a9d9cf1,프론트앤드 개발자,공공의주방 성남 분당구,,"CSS, Javascript(최소 ES5), React 기본 지식 보유... 기타: - HTML(5), CSS, Javascript(최소 ES5), React 기본 지식 보유 - Javascript MV* 프레임웍 기반 웹앱..."
a0ba1ca4652cda5b,고객센터 백엔드 개발,Nexon 성남 분당구,,"사항 - 글로벌 서비스에 대한 경험 - 대용량 트래픽 처리에 대한 경험 - Javascript 라이브러리( React, Vue.js 등)에 대한 경험 - node.js에 대한 개발경험 기타사항 - 업계 최고 수준의 연봉..."
92cb75f8d7457374,웹 서비스 엔지니어 ( 주식정보 제공 시스템 ),에스비씨엔 서울 영등포구,,"경험 : PHP, JavaScript(ES5+), 모던 HTML 및 CSS. 우대사항 - 1년 이상의 React 경험자. - 웹서비스 런칭 및 유지보수 경험자 근무조건 - 근무지: 여의도 - 근무시간: 09..."
5e4b8294f628f52f,(주)코디얼 서비스사업부,코디얼 서울,,"CSS,javascript(ES6 이상), React 기본 지식 보유... React 기본 지식 보유 - javascript MV* 프레임워크 지식 보유 [경력직 요건] - 협업 솔루션 개발 3년 이상 - React..."
59762449180ffb62,G마켓/옥션 Front-End 개발자,이베이 코리아 서울 강남구,,"개발자 - JavaScript(ES6 포함) 와 Markup(HTML,CSS) 에 대한 이해가 있는 분 - React(Redux, webpack)/ Vue 등으로 Frontend 개발 경험이 있는 분 - RESTful API..."
a3aa8c44baea64ca,배민커넥트 배달플랫폼 프론트엔드 개발자,우아한 형제들 서울 송파구,,링을 위한 실시간 관제 시스템 개발 및 운영 - 배민커넥트 라이더스앱( React-Native) 개발 및 운영 우아한형제들 프론트엔드 개발자 직무인... 및 운영 경험이 있으신 분 - React Native 개발 및 운영 경험이...
0ca5a9b1ac697fb3,카카오 댓글/투표/공감 웹 서비스 개발자 모집,카카오 4.0 성남 판교역,,"Docker, Kubernetes, RDBMS, NoSQL, Redis 을 사용하여 백엔드를 개발합니다. React, Vue.js 를 사용하여 프론트를 개발합니다. Kafka, Hadoop, Apache Druid..."
2829f87eb6e0371d,[TmaxBI/R&D] HyperData 제품군 웹 퍼블리셔 신입 및 경...,티맥스소프트 성남 분당구,,블리싱 자격요건 - [필수] React기반 웹 퍼블리싱 경험 - HTML5... 필수] React기반 웹 퍼블리싱 경험 - (신입/경력) 반응형 웹 구축 경험 선택 사항 - (신입/경력) [선택]모바일 React Native...
5123207a169f90eb,Lead AI Platform Developer,AITRICS 서울,,"HTML, Javascript(Typescript), CSS(Sass) Library/Framework : React(Next.js), Vue(Nuxt.js), Rx.js, D3(Observablehq), Jest..."
bb47929cc81c7bd7,[내일애-1차 스마트공장] (주)스페이스솔루션 웹개발자,스페이스솔루션 서울 금천구,,"표준 및 접근성(크로스 브라우징) 관련 이슈 대응 가능자 우대사항 • 웹 프론트엔드 개발 경력 1년 이상 • React, vue.js 개발 경험 • RESTful API 클라이언트 개발 경험이 있으신 분 • UI/UX 가이드..."
ac84c38e5a9d9cf1,프론트앤드 개발자,공공의주방 성남 분당구,,"CSS, Javascript(최소 ES5), React 기본 지식 보유... 기타: - HTML(5), CSS, Javascript(최소 ES5), React 기본 지식 보유 - Javascript MV* 프레임웍 기반 웹앱..."
5e4b8294f628f52f,(주)코디얼 서비스사업부,코디얼 서울,,"CSS,javascript(ES6 이상), React 기본 지식 보유... React 기본 지식 보유 - javascript MV* 프레임워크 지식 보유 [경력직 요건] - 협업 솔루션 개발 3년 이상 - React..."
cc52175e8b9b1963,[TmaxAI/R&D] HyperChatbot 웹 퍼블리셔 신입 및 경력,티맥스소프트 성남 분당구,,"와 CSS-in-JS 사용 - Git 및 형상관리 사용 우대사항 - JavaScript 및 ES6 - React를 활용한 SPA 개발 경험 - Webpack, Babel 등을 이용한 프로젝트 환경 구성 경험 - Web UI..."
c3b9a9aefdf9b877,백엔드 개발자,스파이더랩 서울 강남구,,"대한 이해 주문관리시스템, 상품관리, 정산시스템등 비지니스로직에 대한 이해 RDBMS에 대한 기술적 이해 React, Vue등의 라이브러리로 Single Page Application을 구현이 가능하신 분 근무조건 고용형태..."
bbddc35143e60a4c,Cloud Infrastructure Developer,SAP 4.3 서울,,"Learning Experience developing with Front-End frameworks - React, Angular, Vue.js, etc Experience automating operational..."
82314973e84a9762,서울 근무 웹프론트엔드 개발자 및 JAVA 웹개발자 경력직 채용,"회로부품 기구부품 제조업 / 휴대폰 충전기, USB케이블, 파워코드 등 서울",,"초급/중급/PM급까지) • 담당업무 - 웹프론트엔드 • 업무상 자격요건 - JavaScript 프레임웍( React,Vue.js) 사용 경험자 - TypeScript 사용경험자 - 웹퍼블싱&디자인 : html.css 화면..."
09561d8cf346489b,[지도서비스/FE플랫폼팀] 프론트엔드 개발자 모집,카카오 4.0 성남 판교역,,"주도적인 성장이 가능한 분 협업에 어려움이 없으신 분 지원 시 적어주시면 추가로 도움이 되는 내용 React, Vue.js, Angular 등 최신 framework 중 하나 이상을 실무에서 사용한 경험 TypeScript를..."
e9adeee667db927d,"주식회사 알에스기획 web/app 개발기획, react full stac...",알에스기획 서울 서대문구,,"[모바일] - 모바일 관련 프로젝트 경험자 - 사업기획서 작성 가능자 - 제안서 작성 능숙자 [웹디자인 ] - 컴퓨터그래픽스운용기능사, 시각디자인기사 자격증 소지자 우대 - 디자인 관련 전공 및 동종업계 경력자 우대..."
ae705db15a5c09c2,[공통기술부문] 공통 카프카 엔지니어,우아한 형제들 서울 송파구,,"분 - RDB 및 Elasticsearch, Redis 등 다양한 데이터 스토어의 활용 경험이 있으신 분 - React, Vue 등을 이용한 Frontend 개발 경험이 있으신 분 - 주도적으로 시스템을 모니터링하고 성능과..."
164143859b071719,프론트엔드 엔지니어,RIDI Corp 서울,,"개발 React 기반 웹, 모바일, 데스크탑 등 멀티 플랫폼 클라이언트 개발 자격 요건 프론트엔드 개발 경력 3년 이상 React 개발 흐름과 JavaScript에 대한 깊은 이해 React기반 서비스 개발 및 릴리즈..."
8a48c202f69d2877,Front-end 웹/앱 개발자 (병역특례 가능),스마트디아그노시스 서울 마포구,,"Window App 개발 경험 보유 [담당업무] - Android, React(web) 기반의 UI위주의 구현 - Python(PySide2) 기반의... AWS EC2를 이용한 React App 배포 경험 - Android 및..."
